{
  "schemaVersion": 1,
  "workItemId": "2d3e4f5a-6b7c-4d8e-9f0a-1b2c3d4e5f6a",
  "attempt": 1,
  "threadKey": "JamieGeddes/factorial#factorial/0b8f4a52-5d3c-4c2e-9a51-2f6d1e7c8a90",
  "route": "refuse",
  "source": { "type": "github-pull-request-comment", "id": "b2c3d4e5-f6a7-4b8c-9d0e-1f2a3b4c5d6e", "url": "https://github.com/JamieGeddes/factorial/pull/230#issuecomment-9" },
  "inReplyTo": { "kind": "pull-request", "number": 230 },
  "repository": { "provider": "github", "owner": "JamieGeddes", "name": "factorial" },
  "result": "refused",
  "reason": "busy",
  "at": "2026-10-31T13:05:00.000Z",
  "artefactPrefix": "2d3e4f5a-6b7c-4d8e-9f0a-1b2c3d4e5f6a/1/",
  "branch": "factorial/0b8f4a52-5d3c-4c2e-9a51-2f6d1e7c8a90"
}
